{
  "edges": [
    {
      "faces": [
        "f_0,0"
      ],
      "id": "e1",
      "vertices": [
        "t11",
        "t8"
      ]
    },
    {
      "faces": [
        "f_0,0"
      ],
      "id": "e2",
      "vertices": [
        "t8",
        "t9"
      ]
    },
    {
      "faces": [
        "f_0,0"
      ],
      "id": "e3",
      "vertices": [
        "t14",
        "t9"
      ]
    },
    {
      "faces": [
        "f_0,0"
      ],
      "id": "e4",
      "vertices": [
        "t14",
        "t16"
      ]
    },
    {
      "faces": [
        "f_0,0"
      ],
      "id": "e5",
      "vertices": [
        "t11",
        "t16"
      ]
    }
  ],
  "face_neighbors": {
    "f_0,0": []
  },
  "faces": [
    {
      "edges": [
        "e1",
        "e2",
        "e3",
        "e4",
        "e5"
      ],
      "id": "f_0,0",
      "neighbors": [],
      "type": "pent",
      "vertices": [
        "t11",
        "t8",
        "t9",
        "t14",
        "t16"
      ]
    }
  ],
  "metadata": {},
  "version": "1.0",
  "vertices": [
    {
      "id": "t11",
      "position": {
        "x": 0.0,
        "y": 0.5773502691896257
      }
    },
    {
      "id": "t14",
      "position": {
        "x": 0.0,
        "y": -0.5773502691896257
      }
    },
    {
      "id": "t16",
      "position": {
        "x": 0.3333333333333333,
        "y": 0.0
      }
    },
    {
      "id": "t8",
      "position": {
        "x": -0.5,
        "y": 0.28867513459481287
      }
    },
    {
      "id": "t9",
      "position": {
        "x": -0.5,
        "y": -0.28867513459481287
      }
    }
  ]
}